{
  "schemaVersion": 1,
  "sessionId": "2026-07-11-leading-harness-implementation",
  "title": "leading-harness-implementation",
  "createdAt": "2026-07-11T00:47:05.159Z",
  "updatedAt": "2026-07-11T03:04:32.271Z",
  "status": "complete",
  "workflowId": "core-change",
  "request": "Implement the approved Leading Harness Hardening and Runtime Orchestration plan.",
  "affectedLayers": [],
  "activeAgentId": "deployment-observability-engineer",
  "nextAgentId": "deployment-observability-engineer",
  "qualityTarget": "baseline-setup",
  "requiredOutputs": [
    {
      "name": "architecture decision",
      "status": "complete",
      "evidence": "DECISIONS.md and RUNTIME_ORCHESTRATION_SCOPE.md"
    },
    {
      "name": "maturity evidence",
      "status": "complete",
      "evidence": "Audit v2, manifest v2, coverage gate, package smokes, SBOMs, and browser QA."
    },
    {
      "name": "security review",
      "status": "complete",
      "evidence": "SECURITY.md and runtime security/provider/Studio tests."
    },
    {
      "name": "test evidence",
      "status": "complete",
      "evidence": "194 tests and passing coverage thresholds."
    },
    {
      "name": "doc updates",
      "status": "complete",
      "evidence": "Root and installed-template living docs updated."
    },
    {
      "name": "upgrade evidence when applicable",
      "status": "complete",
      "evidence": "UPGRADE.md and hash-aware manifest v2 update tests."
    },
    {
      "name": "release or rollback notes",
      "status": "complete",
      "evidence": "PUBLISH.md, DEPLOYMENT.md, SUPPLY_CHAIN.md, and two-package release workflow."
    }
  ],
  "renderedAt": "2026-07-11T03:04:32.271Z"
}
