{
  "schemaVersion": 1,
  "sessionId": "2026-07-25-release-0-3-0-08eb334b",
  "title": "Release 0.3.0",
  "createdAt": "2026-07-25T02:16:49.817Z",
  "updatedAt": "2026-07-25T02:16:50.564Z",
  "status": "in-progress",
  "workflowId": "release",
  "request": "Release 0.3.0",
  "affectedLayers": [],
  "activeAgentId": "deployment-observability-engineer",
  "qualityTarget": "baseline-setup",
  "requiredOutputs": [
    {
      "name": "decision",
      "status": "complete",
      "evidence": "Root package 0.3.0 only; runtime 0.1.3 unchanged."
    },
    {
      "name": "risk",
      "status": "complete",
      "evidence": "Maintainer-local recovery required because hosted Actions billing blocks OIDC."
    },
    {
      "name": "verification evidence",
      "status": "complete",
      "evidence": "npm run release:check passed for 0.3.0."
    }
  ],
  "renderedAt": "2026-07-25T02:16:50.564Z"
}
